,Header,Summary,Detail,Link,Category,CreationDate
3,Revisiting taxation strategies,The PPP-backed PML-N government largely represent the feudal/big business class so it may be tempted to tax the retailers without first taxing agricultural incomes and the real estate sector.,"Pakistan is keen on securing a larger and longer International Monetary Fund (IMF) bailout package — the only thing the country can do when it cannot service all its external debts on time.
There is no option of skipping the IMF and seeking more considerable, longer-term funds from friendly countries that have already rolled over billions of dollars worth of such funds offered earlier. Foreign exchange inflows from exports, remittances, and foreign investment hardly match imports and outward remittances, leaving little or nothing for foreign debt servicing. And foreign exchange reserves are not enough to fully cover even two months of imports.
Given the weak external economy, achieving even modest economic growth requires accelerating domestic demand through the optimal use of production resources. At the same time, it is necessary to ensure that the accelerated domestic demand and the consequent growth in production are judiciously taxed along with fuller taxation of hitherto untaxed or undertaxed segments of income. This isn’t an easy job.
Amidst the ongoing gas and electricity tariff hikes, industries and businesses find it difficult to produce more at affordable costs. The wholesale and retail sectors also find it challenging to supply the produced goods and services through a not-so-organised supply chain to the end consumer.

The PPP-backed PML-N government largely represent the feudal/big business class so it may be tempted to tax the retailers without first taxing agricultural incomes and the real estate sector

At this critical point, any move to bring an additional 3.2 million retailers into the tax net must be made carefully, considering every aspect, including the principles of simplicity and equity. There are 3.5m potential taxpayers in the retail sector, but only 0.3m are currently paying taxes. Taxing these retailers may generate an additional revenue of Rs500 billion and widen the tax base.
The PPP-backed PML-N government largely represent the feudal/big business class. So, it may be tempted to tax the retailers without first taxing agricultural incomes and exploiting the full potential of the real estate sector.
According to the World Bank, full taxation of agriculture and properties (taxing the income from these two sectors and closing all tax exemptions available to them) may yield more than Rs3 trillion in taxes or roughly one-third of the current level of tax revenue.
Taxing retailers without taxing agriculture and the real estate sectors may upset the retailers, already braving dwindling demand amidst high inflation and low economic growth, rise in energy prices and multiplicity of taxes, and growing street crimes in Karachi — the hub of trading.
Besides, the bulk of retailing activity, both via brick-and-mortar shops and e-commerce, takes place in big cities, whereas most of the agricultural income primarily lands in rural areas.
Growing social, economic and political divides have increased geographical sensitivities in recent years. Sparing the agricultural chain of activity (whose primary beneficiaries represent the socio-political interests of rural Pakistan) from full taxation will be counter-productive.
Engineering a tax scheme to collect more property taxes from the middle-class urban population and less from the rural population and urban elite will also not work.
The caretaker government prepared the draft of a simplified retailers’ tax scheme titled Tajir Dost (or Trader-Friendly). The PPP-backed PML-N government is expected to finalise and introduce the same scheme with a few amendments. The IMF will be interested in knowing when exactly the scheme will be launched during its current review of its ongoing $3bn lending programme, which ends next month.
Moreover, it would be naive to think that the Fund will not also be interested in knowing the specifics of the proposed tax schemes for agriculture and real estate before even considering a larger, longer-term loan under an Extended Fund Facility. The Fund would likely demand specific timelines for such schemes, and sticking to those timelines would be crucial.
Pakistan’s new Finance Minister, Aurangzeb Khan, pledged in his maiden press conference last week to rapidly implement comprehensive digitalisation of the tax system to enhance transparency. Will the banker-turned-minister be able to fulfil his promise? That’s a million-dollar question. Much depends on whether he gets a free hand to pursue the right policies and how serious the IMF gets in its demand for transparent taxation.
If retailers are successfully brought into the tax net through a digitalised and simplified Tajir Dost scheme and the projected revenue of Rs500bn is realised, that would be no mean feat. The additional revenue may not be significant in Pakistan’s context — roughly five per cent or even less of next year’s estimated tax revenue. However, the registration of 3.2m new taxpayers would enlarge the tax base, which would be crucial for the country’s economy in the medium to long term.
But, to ensure that taxing retailers doesn’t become a political headache, the government will have to implement the principle of equity and continue taxing agricultural and property incomes with the same zeal. Besides, it will have to cut down its lavish expenses, without which no move to broaden the tax base would be successful. Taxpayers pay honestly only when they see their tax money is not being splurged.
The government will also have to come up with innovative policies to enliven domestic demand and promote domestic trade to avoid slippages in tax collection even after the targeted broadening of the tax base. Expanding the taxpayers’ list cannot automatically lead to higher tax collection. Additional tax collection is possible only when the economy is growing.
The agriculture and services sectors are doing a little better than a year ago, but a solid manufacturing recovery may take more time. What matters a lot in sustaining the growth momentum of agriculture and services and in pushing for manufacturing growth is the restoration of political stability — and a new $8bn-$9bn IMF loan.
Published in Dawn, The Business and Finance Weekly, March 18th, 2024
",https://www.dawn.com/news/1822263/revisiting-taxation-strategies,business,2024-03-18
4,AI for agriculture,"By harnessing tech for predictive analytics and precision agriculture, farmers can enhance crop yields and optimise resource utilisation.","Integrating artificial intelligence (AI) into agricultural practices holds immense potential to revolutionise productivity in Pakistan. By leveraging AI-powered solutions tailored to the needs of the agricultural sector, farmers can streamline operations, optimise resource usage, and make data-driven decisions.
However, it is crucial to emphasise that the success of AI integration hinges upon its alignment with the unique challenges and requirements of agriculture. When implemented thoughtfully and ethically, AI technologies can unlock unprecedented levels of productivity and sustainability in the farming sector.
In Pakistan, agriculture is pivotal for economic growth, contributing 21 per cent to the GDP and employing over 42pc of the workforce. The sector’s agro-based products also generate 80pc of the country’s total export earnings. So, it plays a vital role in the economy and livelihoods of millions, hence, the integration of AI is crucial.
It facilitates the prediction of weather patterns, soil quality, groundwater levels, crop cycles, and the detection of plant diseases, all of which are vital decision-changing considerations. Monitoring crop health is enabled by soil and plant sensors, as well as multispectral imagery captured by satellites or drones.

By harnessing tech for predictive analytics and precision agriculture, farmers can enhance crop yields and optimise resource utilisation

Leveraging these insights and innovations can address longstanding challenges such as unpredictable weather patterns, rising temperatures, variability of monsoons, melting of glaciers, water scarcity, and fluctuating market conditions.
By harnessing AI for predictive analytics, crop monitoring, and precision agriculture, Pakistani farmers can enhance crop yields, optimise resource utilisation, and mitigate risks, ultimately bolstering food security and economic stability.
There exists a gap in collaboration between academia and industry, leading to a discrepancy between academic research and its practical applicability in the market. Local universities, including NED University of Engineering and Technology, Institute of Business Administration Karachi, Lahore University of Management Sciences, National University of Sciences & Technology, and FAST National University of Computer and Emerging Sciences, have initiated AI degree programmes, planned specialisations, or established centres for tool and service development.
Agricultural universities such as the University of Agriculture Faisalabad and the University of Veterinary and Animal Sciences are actively exploring AI applications for crop monitoring, disease detection, and solution optimisation. These applications must be aligned with the local scenario and practices.
Pakistan currently holds the highest proportion of young people, as 64pc of the total population of Pakistan is below the age of 30. They possess the potential to evolve into an enormous, well-trained cohort of AI professionals.
Smart farming is a pioneering urban agricultural initiative to establish a hydroponics-based test environment integrated with the Internet of Things (IoT) and AI systems. This integration ensures a controlled and self-sufficient setting for plant cultivation.
Smart farming represents the integration of Web 5.0 technologies into agriculture, exemplified by hydroponics, a soil-less plant cultivation method utilising nutrient-rich water. This endeavor aims to address agricultural challenges in Pakistan by merging physical and digital technologies for optimal sustainability and adaptability.
With a fully monitored hydroponic farming system, IoT interface is also integrated to measure total dissolved solids (TDS), pH, humidity, and temperature. This allows for automated operations, ensuring optimal crop health.
The incorporation of AI into agricultural operations is revolutionising as technology is seamlessly integrated into various aspects of agriculture to enhance efficiency and productivity across the sector.
Specific AI technologies utilised include machine learning algorithms, predictive analytics, and computer vision systems. These technologies enable farmers to make data-driven decisions, optimise resource utilisation, and automate repetitive tasks. For example, machine learning algorithms analyse vast amounts of agricultural data to predict crop yields, identify pest outbreaks, and optimise irrigation schedules.
Computer vision systems, on the other hand, help in crop monitoring and disease detection through image recognition.
The impact of AI-driven solutions on crop yield, resource optimisation, and sustainability practices in Pakistani agriculture is profound. AI algorithms optimise crop production by identifying the most suitable planting times, crop varieties, and fertilisation schedules, leading to increased yields.
AI-powered precision farming techniques minimise resource wastage by precisely targeting inputs such as water, fertilisers, and pesticides, all of which promote sustainable agricultural practices.
Ensuring accessibility and affordability of AI-powered agricultural solutions for small-scale farmers in Pakistan is crucial. Efforts can be made to bridge the technological literacy gap by providing user-friendly interfaces and training programs tailored to farmers’ needs.
Initiatives can be undertaken to make AI technologies financially viable for small-scale farmers through subsidies, grants, and collaborative partnerships with governmental and non-governmental organisations.
The writer is the head of content at a communications agency.
Published in Dawn, The Business and Finance Weekly, March 18th, 2024
",https://www.dawn.com/news/1822261/ai-for-agriculture,business,2024-03-18
5,Irsa amendment row simmers,"""Caretakers are not mandated/empowered to make such decisions on contentious issues"".","Prime Minister Shahbaz Sharif had to withdraw the notification for the appointment of Zafar Mahmood, a retired BS-22 bureaucrat and pro-Kalabagh Dam expert, as a non-member chairman of the Indus River System Authority (Irsa) following a strong reaction from Sindh given its major stakes in water distribution.
Post-1947, irrigation water was allocated in the country through ad hoc arrangements. Following several commissions/committees, the four provinces sat together and agreed to apportion the waters of the Indus River system under the Water Apportionment Accord 1991 (WAA). The provinces’ consent also led to the establishment of the Indus River System Authority (Irsa) under the Irsa Act 1992.
Recently, the incumbent Irsa Chairman, Akhtar Hameed Mengal, sent a draft amendment of the Act to the Ministry of Water Resources, which the caretaker federal cabinet approved. However, the outgoing president, Dr Arif Alvi, didn’t sign the ordinance, which was returned to the government unsigned. This writer tried to reach Dr Alvi to find out whether he gave observations on the ordinance, but he didn’t respond.
The federal government is said to have presented the ordinance to the president, and after 10 days, it was deemed to have become law. The course adopted by the Irsa chairman — who represents Balochistan in the Irsa — was unjustified as the provinces, Council of Common Interests (CCI), and parliament had been bypassed in the decision making.

‘Caretakers are not mandated/empowered to make such decisions on contentious issues’

According to former advocate general Sindh, Zamir Ghumrothe, WAA is the parent of the Irsa Act because the provinces had authorised the federal government to create a structure to regulate interprovincial water distribution — that’s how the Irsa was established under the WAA. So, any amendment to this Act can only be made once provinces are taken on board and the CCI approves with consensus.
“What the caretaker federal government has done to amend the Act unilaterally is patently illegal. Caretakers are not mandated/empowered to make such decisions on contentious issues,” Mr Ghumro says.
As a federal body, the Irsa has been functioning as a water regulator with limited scope, regulating interprovincial water distribution as mandated by the WAA. Besides provincial members, a federal government representative is also a member of the Irsa. Under the Irsa Act 1992, the post of chairman is rotated among provinces annually.
But a simple reading of the ordinance shows it has attempted to alter the structure of the Irsa. It created a new post of vice chairman for the provinces as it delegated authority to the federal government to appoint a non-member (a serving or retired federal government BS-22 employee) as chairman of the Irsa with authority to exercise all sorts of autonomy through an expert committee.
The chairman is supposed to decide on any question on water whereas, under the Irsa Act 1992, a reference could be filed before the CCI by provinces if aggrieved by a decision. The CCI is constitutionally mandated to decide water issues with consensus.
What necessitated the caretaker government to amend the 1992 Act and undermine existing countrywide water management is anybody’s guess. When this amendment was planned, Sindh caretaker irrigation minister, Ishwar Lal, wrote a letter to the then-premier on Feb 2, informing him that after the 18th amendment, “water is neither a federal nor a provincial subject as it falls under the domain of the CCI which is the highest constitutional body to prevent, manage, or resolve intra-federal conflicts and issues on the basis of consensus rule”. He had urged him to drop this proposal till an elected government was in office, but in vain.
As a lower riparian area, Sindh has a significant share of around 23 per cent of Pakistan’s agricultural sector. Yet, it remains at a disadvantage regarding water distribution quite often — especially during the Kharif period when much-needed water is unavailable.
Due to questionable water distribution by the Irsa, the water shortages in Kharif are not equally shared. Sindh and Punjab bear the burden alone, without Khyber Pakhtunkhwa and Balochistan, which the Irsa exempts. The Kotri barrage regularly receives a 60pc to 70pc shortage of agricultural water supplies in almost every Kharif season.
“Shortage in Kharif is not only a direct economic loss for Sindh but also for Pakistan. Weather conditions help the sowing of cotton in Sindh by early March. Water unavailability, however, affects it as dams remain empty in this period. Cotton, being a major cash crop, has the potential to earn foreign exchange. Regarding overall shortage, Sindh has over and above average shortages in the river,” remarks Zahid Junejo, Sindh’s outgoing representative in the Irsa.
According to Zarif Iqbal Khero, a former secretary of irrigation and Sindh’s expert on interprovincial water distribution, even the Irsa has a limited scope within the provisions of the WAA. It can’t function at its whims to allocate water for new canal commands, propose amendments in the Act, or devise formulas other than those mentioned in Chapter II of the Accord and the 10-daily basis operating strategies approved by the CCI.
Interprovincial water distribution, historically, has been a bone of contention between Punjab and Sindh, with Sindh pressing for water distribution under the WAA; the Irsa has been ensuring the distribution of a three-tier formula since 2003. This issue has been pending before the CCI since 2018.
Former attorney general Anwar Mansoor, who led the committee formed by then-premier Imran Khan to look into the matter, had backed the “stance of Sindh on the three-tier formula” in its report before the CCI. But the matter was referred to another committee led by then-attorney general Khalid Jawaid, who subscribed to the Mansoor-led committee’s view. No headway has been seen since then.
In this formula, the Irsa ensures storage, deducts losses, and then distributes water among provinces but exempts Balochistan and Khyber Pakhtunkhwa from bearing shortages, informs Mr Khero. “This formula doesn’t affect Punjab. It is already getting more than its share. Sindh ends up having a net shortage of six million acre feet — equal to Tarbela’s storage”, he explains.
Punjab’s position on the three-tier formula, says Irsa spokesman Khalid Idris Rana, is that the formula is guided by three different provisions of the WAA, ie points two, four and 14-B. Therefore, it has sanctity, whereas Sindh stands for point two-based water distribution. “The CCI now has to come up with a decision on it,” he informs.
To address Sindh’s water-related concerns, Gen Pervez Musharraf, through an executive order, made it mandatory that the Irsa’s federal member always be a person with “Sindh domicile”. This ensured two votes for Sindh — one of Sindh’s own members and one of the federal members— when voting on any matter relating to water distribution.
The arrangement worked for some time, and Sindh-based officials like Fazalur Rehman and Bashir Dahar served as federal members. Later, the matter landed in the Sindh High Court (SHC), which was moved by Ghulam Abbasi Leghari regarding the issue of his nomination as a federal member. The Sindh High Court (SHC) ruled in his favour, but the federal government questioned it in the Supreme Court. Since then, the matter of the federal nominee is also pending.
Published in Dawn, The Business and Finance Weekly, March 18th, 2024
",https://www.dawn.com/news/1822260/irsa-amendment-row-simmers,business,2024-03-18
6,KSE 100-share index fluctuations,Chart by Rehan Ahmed,"

Chart by Rehan Ahmed

 
Published in Dawn, The Business and Finance Weekly, March 18th, 2024
",https://www.dawn.com/news/1822259/kse-100-share-index-fluctuations,business,2024-03-18
7,Rupee report: Weekly rupee-dollar parity,Chart by RA,"

Chart by RA

 
Published in Dawn, The Business and Finance Weekly, March 18th, 2024
",https://www.dawn.com/news/1822258/rupee-report-weekly-rupee-dollar-parity,business,2024-03-18
8,COMPANY NEWS,"The administration of Sindh Agriculture University, Tandojam, has announced that in accordance with the prescribed schedule","Tandojam academic activities
The administration of Sindh Agriculture University, Tandojam, has announced that in accordance with the prescribed schedule, midterm examinations and academic activities at Sindh Agriculture University will continue as usual, as per a press release. Students and faculty are advised not to ignore rumours or unauthorised announcements.
According to details provided by the university spokesperson in its issued statement, it has been stated that the midterm examinations starting from today (Monday) will be conducted in all university faculties as per the schedule. In this regard, students and faculty members are advised not to heed rumours or unauthorised announcements. They have stated that if there is any issue related to the teachers’ community regarding their issues, a Dean’s committee has been constituted for this purpose, and relevant professors are directed to contact the Dean’s committee regarding any issues. 
Pakistan Cables art contest 
Pakistan Cables recently organised the 3rd Pakistan Cables Children’s Art Contest 2024, as per a press release. The contest invited entries from the Company employees’ children from two age groups: 6 -11 years old and 12 - 14 years old. This year, the theme “Pakistan Climate Action Plan 2025” was selected to highlight climate change issues and the priorities to combat the country’s impact on climate change.
Contestants attended a colourful prize distribution ceremony at the Dawood Foundation Magnifiscience Centre, Karachi. The chief guest at the ceremony, Faraz Maqsood Hamidi, a well-known creative leader in Pakistan’s advertising industry, encouraged children to challenge the norms and never give up their creative pursuits. An esteemed panel of judges included renowned visual artist Durriya Kazi, founder of ARTEL, Bina Ali and Project Manager of Sindh SDGs Unit, UNDP, Naveed Shaikh. n
Soneri Bank’s annual results 
The annual audited financial statements of Soneri Bank Limited for the year ended Dec 31 2023, were approved by the shareholders, as per a press release.
The bank posted profit-after-tax (PAT) of Rs6,075m in 2023, compared to Rs1,883m in 2022, which represents a healthy growth of 222.6pc. The Bank’s Net Interest income for the year was reported at Rs 22,759m, significantly increased by 102pc against Rs11,267m for the prior year.
In 2023, the bank surpassed its landmark number of half a trillion, and its deposits registered an increase of 26.4pc compared to Dec 31, 2022, ending at Rs517,869m on Dec 31 2023. 
FPCCI appoints convener 
The Federation of Pakistan Chambers of Commerce & Industry (FPCCI) recently announced Saleem Khan Tanoli’s appointment as the convener of its Central Standing Committee on Trade Promotion & Business Development, according to a press release. Mr Tanoli has previously served as the vice chairman of the Standing Committee on Foreign Affairs and chairman of the Regional Standing Committee on Fairs and International Relations at the FPCCI.
Currently serving as the CEO of Fakt Exhibitions, Saleem Khan Tanoli brings a wealth of experience and a proven track record in championing trade initiatives and fostering business development. 
Paklaunch seed fund 
Paklaunch, which aims to advance entrepreneurship and innovation in Pakistan’s startup ecosystem, successfully closed its seed funding with an undisclosed value, as per a press release.
With this funding, Paklaunch seeks to create a flourishing ecosystem for regional startups in Pakistan and the Gulf Cooperation Council (GCC). Leveraging its investment expertise, global connections, and Disrupt.com’s entrepreneurial ethos, Paklaunch extends its influence beyond Pakistan, encompassing key GCC countries such as Saudi Arabia and the UAE. 
SBP & Zindigi Raast P2M initiative
Zindigi, aligning with the strategic vision of the State Bank of Pakistan, leads innovation by empowering merchants nationwide with the Raast  Person to Merchant (P2M) payments ecosystem, as per a press release. Zindigi, powered by JS bank, is among the first to adopt a P2M initiative.
All Zindigi app users can use smartphones to pay any Raast P2M QR codes across Pakistan. 
Published in Dawn, The Business and Finance Weekly, March 18th, 2024
",https://www.dawn.com/news/1822196/company-news,business,2024-03-18
