,Header,Summary,Detail,Link,Category,CreationDate
9,CORPORATE WINDOW: Patience wearing thin,The government’s wellbeing depends on prioritising and protecting its people grappling with falling family incomes and rising living costs.,"Pakistanis deserve better. It is imperative for an elected government to strive to enable people to live lives free from want, fear and indignity. Securing the next International Monetary Fund (IMF) tranche and striving for another longer, larger programme is important. 
However, history unequivocally demonstrates that a government’s success hinges on recognising its citizens as the purpose and agents of development. Prime Minister Shahbaz Sharif’s government and his economic team, led by Finance Minister Aurangzeb Khan, need to clarify the vision of the ruling coalition in this regard.
The targets of a five-year economic revival plan — currently in development — encompass reducing poverty, creating jobs and improving revenue generation. However, the precise strategy for achieving these objectives remains to be seen, particularly for a resource-starved coalition government pursuing stabilisation policies under the close watch of the IMF. 
Historically, stabilisation policies have entailed economic hardships, which the people of Pakistan have repeatedly borne with the promise of future gains. Unfortunately, they have not always been able to partake equitably in the benefits of subsequent economic growth spurts. This dynamic partially explains the unpopularity and abrupt exit of past regimes despite the higher average growth rates recorded during their tenures.

The government’s wellbeing depends on prioritising and protecting its people grappling with falling family incomes and rising living costs

During his first week in office, Finance Minister Aurangzeb Khan shared his insights and economic priorities through interviews and media interactions covering various issues. Expressing confidence in the prime minister’s leadership, he pledged to continue the ‘commendable’ work initiated by caretaker finance minister Dr Shamshad Akhtar. 
Mr Khan highlighted the improvement in key economic indicators during the first quarter of the current fiscal year, attributing it to Dr Akhtar’s strict adherence to stabilisation policies. He emphasised that these measures have bolstered Pakistan’s position, enabling successful engagement with the IMF to conclude the review and secure the release of the last $1.1 billion tranche of the nine-month Stand By Arrangement.
He was hopeful that the successful completion of the current programme would pave the way for negotiations for a larger, longer programme during the IMF and World Bank’s meetings in Washington in April. Emphasising the importance of stabilisation policies, he referred to them as the ‘Pakistan programme’ for which he vowed to seek the IMF’s backing.
He mentioned plans for the digitisation of the Federal Board of Revenue to curb leakages, expand the tax base by roping in untaxed and undertaxed segments, committed to curtailing public expenditure by scaling back Public Sector Development Plan (PSDP), and propose involving the private sector in public works through adoption of the successful public-private partnership model used in Sindh. 
Rather than seeking loans from friendly nations, he aimed to persuade them to invest directly in the country. He commended the efforts of the Special Investment Facilitation Council and envisioned its pivotal role in mobilising local and foreign investment.
Mr Khan anticipates opening avenues for commercial borrowing from Gulf Cooperation Council banks once Pakistan enters a longer-term IMF Programme. With the economy consolidating, he foresaw an improvement in Pakistan’s credit rating, which would enhance its standing in the global credit market. He also discussed the possibility of issuing Panda bonds and expressed a desire to tap into the Chinese bond market.
He shared his intension to expedite the second phase of the China Pakistan Economic Corridor, which focuses on cooperation in the industrial, agricultural and technological sectors. Specifically, he showed keen interest in advancing operationalisation of special industrial zones.
He stressed the importance of export-led growth for sustainability and committed to providing competitive energy rates, particularly for the textile sector. He foresees substantial gains from freelance information technology (IT) work, with projected IT exports exceeding $3.5 billion in 2024. Additionally, he anticipates rice exports to fetch $2bn this year. 
The government remains steadfast in its support for agriculture and mining, projecting a five per cent economic growth rate over time if plans proceed smoothly. 
Privatisation is a priority, with plans underway to privatise Pakistan International Airlines (PIA) and, eventually, power distribution companies. The finance minister also hinted at forthcoming reductions in both foreign exchange and policy rates. 
Notably absent from the discussion were the concerns of workers and salaried classes facing immense economic strain, grappling with dwindling family incomes and depreciating asset values. His stance appeared to lean towards the overly simplistic trickle-down theory, perhaps assuming that all members of society, regardless of class, gender, region or profession, would inevitably reap the benefits as the economy stabilises and grows.
Such unfounded assumptions have failed to materialise in the past, and clinging to them now could pose significant risks for a fragile government and a nation already teetering on the brink of an economic crisis. 
“It’s absurd for Shahbaz Sharif’s government to test peoples’ patience at this time. While direct cash transfers to the poorest are essential given Pakistan’s lack of a social security net, the working masses in the middle of the social spectrum are feeling the squeeze with falling family incomes and rising living costs. The government must provide policy support to them, along with caring for risk-averse bankers, barons and brokers,” remarked an analyst.
Speaking on the resilience of the Pakistani people, he noted, “Whether it’s rooted in faith, strong family ties or other factors, Pakistanis consistently demonstrate their ability to rebound from adversity. Despite enduring dictatorships, natural disasters, war fallout, the pandemic, terrorist strikes and governmental betrayals, they exhibit remarkable resilience. Not only do they persevere to survive, but they also actively engage in the political process. 
“Imposing higher fuel and power rates on citizens would be not only unjust but also risky. I firmly believe that the future of both the government and the country hinges on recognising the primacy of citizens and prioritising their wellbeing. Policies must give due consideration to their aspirations for sustainable, inclusive development.” 
Published in Dawn, The Business and Finance Weekly, March 18th, 2024
",https://www.dawn.com/news/1822195/corporate-window-patience-wearing-thin,business,2024-03-18
10,The resolve to reform is needed,Past attempts to spur growth without deep-rooted stabilisation ended in an external sector crisis.,"Finance Minister Muhammad Aurangzeb says his singular agenda is to focus on the implementation of much-needed reforms and to negotiate a new larger deal with the International Monetary Fund (IMF) to pull the economy out of the crisis.
“No debates, no waste of time — just a steadfast commitment to implementation,” the former Habib Bank chief told Dawn soon after being sworn in as the federal finance minister. In essence, it was a strong message that he would accord top priority to structural reforms.
Referring to the need for effective taxation of agriculture, real estate, and the wholesale sector, he said extensive work has been done regarding the implementation stage, and the designer and partners have already been finalised.
His first priority would be to plug leakages in the Federal Board of Revenue (FBR) through end-to-end digitalisation to provide fiscal space for the government.

Past attempts to spur growth without deep-rooted stabilisation ended in an external sector crisis

Almost the entire 30 per cent jump in FBR tax revenue, so far, this fiscal year is attributed by analysts to high rate of inflation. The tax-to-GDP ratio is less than 9.5pc and Rs1.7tr is stuck in the legal process.
Praising the Special Investment Facilitation Council, the finance minister expressed confidence that it would aid in implementing economic policies.
The finance minister observed that GDP growth is directly linked to macroeconomic stability. Past attempts to spur growth without deep-rooted stabilisation ended in an external sector crisis.
The Economic Affairs Division (EAD) says that prudent external debt management coupled with strong institutional arrangements is necessary for the management of external debt and repayment capacity of the country.

For a longer IMF programme to be smoothly implemented, a gradual easing of its stiff terms is required to create fiscal space

Borrowings can be productive for the economic growth of developing countries as long as the economic returns are higher than the cost of borrowing funds, the EAD stressed.
Pakistan has not used development assistance prudently and effectively, with long delays in the execution of projects and cost overruns, making them financially unviable.
Analyst Shahbaz Khan says that with Pakistan’s debts now reaching approximately 91pc of the GDP and the economy declining rapidly, very little progress has been made towards economic independence.
Certain IMF experts have found during their research that development aid has a robust effect on growth. Simultaneously, non-development is mostly growth-neutral and occasionally negatively associated with economic growth. Much of Pakistan’s borrowings are for repayments of old debts or balance of payments support.
To avoid unsustainable debt, the government has reportedly decided that foreign funding will be secured only for priority sectors. Proposals for restricting lawmakers’ funds are under consideration of authorities and the centre aims to drastically reduce federal-funded provincial projects.
Pakistan has to come out of the mindset of doing patchwork to deep-rooted economic problems. Macroeconomic stability needs permanency, and for that, a larger and longer duration IMF programme is required. The GDP growth path is through macroeconomic stability, explains Mr Aurangzeb.
Economic literature demonstrates that it is normal for imbalances to occur in the process of economic growth and development. These imbalances need to be addressed promptly without allowing the issue to linger and become a serious crisis.
Durable stability cannot be achieved without production-oriented economic growth by maximising the use of indigenous resources to meet domestic demand and needs of the people through balanced and harmonised development of all sectors and regions and the removal of unacceptable levels of household income disparities.
For a longer IMF programme to be smoothly implemented, a gradual easing of its stiff terms is required to create fiscal space to spur economic growth, provide decent jobs and reduce poverty, ie to achieve growth with stability in a much shorter time. This is necessary to create a congenial political environment to avoid political risks/spanners.
It is also worth noting that Pakistan’s United Nations (UN) envoy, Ambassador Munir Akram, recently urged the UN to strengthen its commitment to supporting developing nations in tackling debt sustainability challenges. However, more significant is his observation that support should come through “innovative financing mechanisms.”
It cannot be denied that at least some of the IMF’s decades-old prescriptions have become outdated in these turbulent times.
As a professional banker, one hopes that the finance minister will be able to use his technocratic skills to quickly clinch a new and better deal with the IMF — secure more space in the Fund’s programme for sustainable and inclusive growth while avoiding the risk of foreign debt default.
The country’s challenges can be better addressed by persuading the IMF to adopt innovative financing mechanisms to suit the changing times.
Then, in case of unavoidable slippages owing to external or domestic shocks, or any genuine reason, the finance minister should be able to secure the IMF waivers to avert hiccups in the execution of the agreed programme.
Published in Dawn, The Business and Finance Weekly, March 18th, 2024
",https://www.dawn.com/news/1822194/the-resolve-to-reform-is-needed,business,2024-03-18
11,Data points,"Generation Z entered the workplace when there wasn’t even one to go to. Those years, marked by a global health crisis and social","Gen Z teams
Generation Z entered the workplace when there wasn’t even one to go to. Those years, marked by a global health crisis and social unrest, helped shape their views about life as well as work. Many of them were home as their parents’ workplaces closed, so they got a ground-floor view of what jobs really looked like, and they didn’t like what they saw: a work-life balance that left little time for life, management that seemed to not care about the mental health of their employees and an organisational structure that didn’t give workers much of a voice. Now, they have an opportunity to shape the workplace as they begin to enter the ranks of management themselves. While members of Gen Z — generally defined as people born sometime between 1997 and 2012 — now account for only 16.8pc of the total workforce, according to data analysed by ADP Research Institute, they are ascending rapidly: Employers promoted Gen Z workers into management 1.2 times faster in 2023 than in 2019.
(Adapted from “What’s It Like to Work for a Gen Z Boss? Very Different,” by Anne Marie Chaker, published on March 10, by the Wall Street Journal)
Adani probe
US prosecutors have widened their probe of India’s Adani Group to focus on whether the company may have engaged in bribery as well as the conduct of the company’s billionaire founder, according to people with direct knowledge of the matter. Investigators are digging into whether an Adani entity, or people linked to the company including Gautam Adani, were involved in paying officials in India for favourable treatment on an energy project, said the people, who asked not to be identified discussing the confidential effort. The probe, which is also looking at Indian renewable energy company Azure Power Global, is being handled by the US Attorney’s Office for the Eastern District of New York and the Justice Department’s fraud unit in Washington, said people familiar with the matter. “We are not aware of any investigation against our chairman,” Adani Group said in an emailed statement. 
(Adapted from “US Probing Indian Billionaire Gautam Adani And His Group Over Potential Bribery,” by Tom Schoenberg and Ava Benny-Morrison, published on March 15, 2024, by Bloomberg)
Automated cars as offices
As automated driving gets closer to reality, car designers and technology companies are giving more thought to what people might actually do in their cars when they no longer have to drive them —including how they may use them to work. Prototype designers are experimenting with interiors that break all the rules. Once a car no longer needs a human driver, the room inside can be designed as a lounge or an office with a desk. Nearly one in five automobile buyers who participated in a 2022 survey conducted for consulting firm McKinsey said if they didn’t have to drive themselves, they wanted their car to be designed as a fully functioning office. The annual McKinsey consumer survey was conducted in December 2022 and polled 27,036 people worldwide.
(Adapted from “Self-Driving Cars Might Just Transform the Way We Work,” by William Boston, published on February 19, 2024, by the Wall Street Journal)
Working from office
More and more workplaces are calling employees back to the office. If you started your career remotely, this may be a big shift for you. How can you manage it? 1) Reimagine your routine. Figure out what time you need to be at your desk, and then rework your schedule to make sure you’ll be there on time. This may involve waking up earlier to run a few errands and calculating your commute. 2) Get the right gear. For instance, you may need a backpack to carry your laptop to and from the office, or noise-canceling headphones to help you avoid distractions. 3) Pay attention to office culture. Observe how people act in meetings, how often your colleagues take breaks, and what appropriate work clothes look like. 5) Embrace the opportunity. Take advantage by interacting with your peers, your boss, and your coworkers regularly.
(Adapted from “Going Into The Office For The First Time?” by Elizabeth Grace Saunders, published by HBR Ascend)
Published in Dawn, The Business and Finance Weekly, March 18th, 2024
",https://www.dawn.com/news/1822193/data-points,business,2024-03-18
12,Thinning out the ranks,"Middle managers — defined as non-executives who oversee employees — made up almost a third of layoffs in the US,...","Middle managers — defined as non-executives who oversee employees — made up almost a third of layoffs in the US, up from 20pc in 2018, according to an analysis by Live Data Technologies for Bloomberg
Published in Dawn, The Business and Finance Weekly, March 18th, 2024
",https://www.dawn.com/news/1822192/thinning-out-the-ranks,business,2024-03-18
13,Boomer  leaders,"A decade ago, just one of the world’s 10 most populous countries, India, had a leader who was 70 or older — as ...","A decade ago, just one of the world’s 10 most populous countries, India, had a leader who was 70 or older — as of February, eight of them did, putting at least half the global population in the hands of people in their 70s and 80s, reports the Wall Street Journal
Published in Dawn, The Business and Finance Weekly, March 18th, 2024
",https://www.dawn.com/news/1822191/boomer-leaders,business,2024-03-18
14,Ultimate PR goodie bags,"Oscar winners and nominees receive a goodie bag worth about $178,000 that consists of gifts based on marketing deals...","Oscar winners and nominees receive a goodie bag worth about $178,000 that consists of gifts based on marketing deals with PR agencies, as per the Wall Street Journal
Published in Dawn, The Business and Finance Weekly, March 18th, 2024
",https://www.dawn.com/news/1822190/ultimate-pr-goodie-bags,business,2024-03-18
15,Low-level marketing jobs,"Nearly 6 out of 10 marketing students are working high school-level jobs five years after graduation, a new study...","Nearly 6 out of 10 marketing students are working high school-level jobs five years after graduation, a new study says, according to Bloomberg
Published in Dawn, The Business and Finance Weekly, March 18th, 2024
",https://www.dawn.com/news/1822189/low-level-marketing-jobs,business,2024-03-18
16,A meal in space,Deep-pocketed food and space lovers will soon be able to enjoy gourmet dining in the stratosphere for a price of...,"Deep-pocketed food and space lovers will soon be able to enjoy gourmet dining in the stratosphere for a price of almost $500,000 a ticket by SpaceVIP, a luxury space travel company, reports Bloomberg
Published in Dawn, The Business and Finance Weekly, March 18th, 2024
",https://www.dawn.com/news/1822188/a-meal-in-space,business,2024-03-18
17,EVs — toys for  the rich?,"Complete EV transition is inefficient and unviable, except for a wealthy few","February saw some activity in Pakistan’s automobile sector, as four new vehicles, three of them electric, were introduced into the market. 
Pakistan’s automobile industry has always been highly criticised. High-priced, low-quality vehicles, delayed deliveries, black market premiums, lack of features, high import dependence despite decades of localisation fantasy, and protectionist policies, among many other issues, have persisted for decades. However, at this time, all has not been downhill. 
Instead, the nexus of the ‘big three’(Pak Suzuki Motor Company, Honda Atlas Cars Pakistan, and Indus Motor Company Limited) has been dented by the entry of almost ten new automobile assemblers and manufacturers. Consumer options have improved as competition in the sedan segment increased, while the market has also been flooded with compact sports utility vehicles (SUVs). 
Despite introducing more vehicles, automobile production remains stagnant, and restrictions on automobile and parts imports increased as economic governance worsened. 

Complete EV transition is inefficient and unviable, except for a wealthy few

The global automobile industry, meanwhile, has made leaps forward towards achieving the target of replacing over three-fourths of automobiles with electric vehicles (EV) by 2030. Many brands and countries have either already or are about to cease production of internal combustion engines (ICE) and move entirely towards EVs. 
Pakistan also launched its first-ever National Electric Vehicle policy in 2019 as part of its commitment to work towards Sustainable Development Goal (SDG) 11, which aims to make cities and human settlements inclusive, safe, resilient, and sustainable. Managing air quality in urban areas is a key factor in achieving SDG 11, and the efforts to shift towards EVs are expected to play a pivotal role.
However, it is important to acknowledge the ground realities. As per the latest Pakistan Social & Living Standard Measurement Survey, only six per cent of households own a vehicle in Pakistan while the country’s peak demand for new automobiles is only around 0.25 million annually. This shows that automobiles are not affordable for a vast majority, and with the continuous increase in prices of new cars, the demand for them continues to shrink.
In such an economy, dreaming of a complete or major EV transition in the automobile industry is not only far-fetched but impossible. EVs are not only financially unattainable for the public — apart from a select few — but also unviable. 
A major question pertaining to the EV transition is, much like the chicken and the egg problem, what comes first: the charging infrastructure or the EVs?
Commercial charging infrastructure will not be a profitable business unless demand increases through increased EV ownership. However, EVs will not be a practical option if commercial charging infrastructure is unavailable.
The lack of fast chargers, especially on intercity highways, makes EVs unusable for intercity travel. Meanwhile, long charging times at home and continuous electricity disruptions make charging a massive headache for daily intracity users. Similarly, even commercial chargers are faced with the continuous threat of electricity disruptions due to the inadequacies of the energy sector itself. 
In such a scenario, purchasing an EV seems like a realistic decision to use as a second vehicle for intracity mobility only. 
Consequently, EVs are an attraction for only the handful of households that have the capacity to spend at least Rs10m for a second vehicle.
Automobile companies in Pakistan have recently introduced hybrid electric vehicles (HEV), which have pulled automobile consumers towards them. With constantly increasing fuel prices, hybrid vehicles are a practical option for Pakistani consumers, reducing fuel expenditures. 
In past years, imported and even plug-in hybrid electric vehicles (PHEV) have been preferred by consumers along with 660cc engine vehicles. This represents a clear preference for low-fuel-consuming vehicles in the country if options are made available. 
Some believe that Pakistan’s shift to EVs will begin with two-wheel and three-wheel vehicles. This view has some grounding, as over 60pc households in Pakistan own a two-wheel vehicle while 2.7pc households own a three-wheel vehicle used primarily for commercial or public transport purposes. Subsequently, the target population for two- and three-wheel EVs is much greater, but that too comes with its constraints.
Firstly, EV bikes cost at least more than twice the cheapest motorcycles available. Secondly, ICE bikes have significantly lower fuel consumption and, thus, are not a major expenditure burden for most. Meanwhile, EVs are not only more expensive but also have a low range per charge and require long charging times, mostly overnight. This makes commercial or public transport use of two and three-wheelers unviable.
EVs in Pakistan currently seem to be lacking in financial benefit to the user as well as any practical benefit for the shift. Instead, they restrict the possible commute and mobility options due to their constraints. 
The writer is a research fellow at Pide 
X: @MShaafNajib14
Published in Dawn, The Business and Finance Weekly, March 18th, 2024
",https://www.dawn.com/news/1822187/evs-toys-for-the-rich,business,2024-03-18
