,Header,Summary,Detail,Link,Category,CreationDate
0,An unambitious growth path,"As seen with Argentina, Egypt, and Ethiopia, an arrangement with the IMF is not insurance against economic failure.","


 
Over the past three decades, Pakistan’s economic focus, particularly in its dealings with the International Monetary Fund (IMF), has centred on addressing twin deficits — current account and fiscal. Despite concerted efforts, these issues have persisted, signalling the need for a fundamental shift in approach.
While managing deficits remains crucial, this writer believes sustainable economic growth, driven by increased foreign direct investment, must become the linchpin of Pakistan’s policy agenda. Only through a comprehensive realignment of all policies towards this goal can Pakistan navigate its way out of the vicious cycle of debt, low growth, inflation, and poverty.
The root causes of Pakistan’s low investment and savings rates are deeply entrenched in structural issues, requiring significant political, economic, and social reforms. The recent arrival of an IMF mission for a review underscores the urgency of addressing these challenges.
While the government’s focus on seeking an Extended Fund Facility after the current standby arrangement expires is understandable, it must recognise that the IMF conditions alone are insufficient for achieving sustained growth and transformation.

As seen with Argentina, Egypt, and Ethiopia, an arrangement with the IMF is not insurance against economic failure

The current IMF conditions linked to raising taxes, abolishing subsidies, maintaining market-determined exchange rates and privatisation are remarkably similar to those in the previous programmes and are unlikely to change.
While Pakistan has been forced to take the IMF conditions more seriously this time, the history of Pakistan’s 23 prior arrangements with the IMF, as well as those in Argentina, Egypt, and Ethiopia, suggest they will not be sufficient to achieve stable growth and economic transformation needed for a country with one of the highest population growth rates in the world.
Historically, successive governments have pledged to enhance tax collection but have fallen short, adversely affecting the investment climate in the process. While digitising the tax system is a positive step, it must be complemented by broader reforms to stimulate economic activity.
Recognising the pivotal role of investment, efforts have been made to attract FDI through initiatives such as the Special Investment Facilitation Council. However, a coherent economic revival plan is imperative for long-term stability and prosperity. Foreign private investors should be the primary focus of this plan.
A comparative analysis with neighbouring India and Bangladesh highlights Pakistan’s lag in key economic indicators, such as revenue-to-GDP ratio, savings rate, and investment-to-GDP ratio. These disparities underscore the need for a paradigm shift in policy priorities and sequencing of reforms.
It may surprise some that while Pakistan’s revenue to GDP lagged behind India’s by an average of 7 percentage points, it stayed above Bangladesh’s by an average of 4 percentage points.
Low Savings Rate
Another critical indicator is the domestic savings to GDP ratio. Historically, Asian countries with some of the highest saving rates outperformed the rest of the developing world by a wide margin.

Pakistan’s low savings rate can’t be due to a large informal economy as Bangladesh and India also have large informal sectors but higher savings

Pakistan’s savings rate is strikingly low compared to Bangladesh and India. It cannot be attributed to just a large informal economy as both of these countries have large informal sectors as well.
In 2022, India’s savings rate was 29.1 per cent, Bangladesh’s 25.2pc and that of Pakistan barely 4pc. From 2003 to 2022, India’s average was 31.1pc, Bangladesh’s 22.9pc and Pakistan’s a lowly 8.6pc.
Low Investment Rate
Why has Pakistan’s growth faltered so much compared to its South Asian neighbours? Let’s look at the investment-to-GDP ratio of the three countries.
In 2023, Bangladesh’s tax-to-GDP ratio was under 10pc but investment-to-GDP was 31pc compared to Pakistan’s 13.6pc. India’s tax-to-GDP ratio was 11.2pc but the investment-to-GDP ratio was 34pc.
While IMF engagement is necessary, Pakistan must develop a well-prepared plan that extends beyond meeting its conditions. It should encompass radical liberalisation and deregulation measures, drawing lessons from the experiences of successful economies like India and South Korea.
The cautionary tale of Ethiopia’s state-led growth model serves as a reminder that unsustainable borrowing for large-scale projects can exacerbate economic vulnerabilities.
China accounted for nearly 50pc of Ethiopia’s $28 billion external debt in 2023. The state-led model saw Ethiopia’s exports fall from 13.7pc of GDP in 2012 to an average of 7.7pc in 2019-2022.
Last December, Ethiopia became the third African country to formally default on its debt in as many years after missing the deadline to make a $33 million interest payment on its only international bond. This default places the East African country among a growing number of emerging economies that have defaulted on their debt in the aftermath of the pandemic.
According to the World Bank, there have been 18 sovereign defaults in 10 developing countries in the past three years, a number greater than any recorded in the previous two decades.
The different growth models and lessons therein merit carefully reviewing our priorities and goal-setting process. As we have seen in Argentina, Egypt, and Ethiopia, an arrangement with the IMF is not insurance against economic failure or even default.
Pakistan should focus on fostering investments and technology transfer to drive growth sustainably. While collaboration with the IMF may be necessary (as South Korea and India did in the 1990s), it should not be viewed as the ultimate objective.
Rather, Pakistan must chart a course tailored to its unique circumstances, judiciously mobilising international support, particularly that of foreign private investors, to realise its economic potential.
The writer is former head of Citigroup’s emerging markets investments and author of ‘The Gathering Storm’
Published in Dawn, The Business and Finance Weekly, March 18th, 2024
",https://www.dawn.com/news/1822266/an-unambitious-growth-path,business,2024-03-18
1,Stalled energy solution,Plans to establish coal to gas and liquid conversion plants for energy and urea production are on hold despite private sector interest due to federal inertia.,"The initial brouhaha notwithstanding, the Sindh government’s plan to produce gas and liquid fuels for urea production, electricity generation, and transport doesn’t seem to be getting anywhere even after the passage of several years and despite investor interest.
Sindh Coal Authority officials blame the federal government’s failure to devise a policy to “support investment as a main impediment to any tangible progress on the plans” to explore the possibility of conversion of coal to gas and liquid.
When asked what was stopping Sindh from moving ahead with its plan and signing investment deals with interested local and foreign companies, a senior Sindh Energy Department official argued, “Constitutionally, the provinces are owners of their ground hydrocarbon energy resources but the powers to regulate international and interprovincial movement of energy, determine prices of different fuels and energy goods, impose taxes and fees, and decide use for power generation, urea production or transportation are with the federal government in the interest of the country’s economic development and energy security.
“The province, therefore, cannot implement its coal-to-gas or coal-to-liquid project or involve private investors in it unless the federal government finalises a policy to regulate this sector.”

Plans to establish coal to gas and liquid conversion plants for energy and urea production are on hold despite private sector interest due to federal inertia

Converting coal to gas and liquids (diesel) using vast reserves of lignite in Thar was one of the options initially proposed by the Sindh government to deal with the energy crisis and mitigate climate change concerns due to the growing use of indigenous and imported coal for power generation and other purposes.
The Sindh government started work on a proposal to tackle the projected shortfall of 2.6 million tons per annum (mtpa) of urea in the country by 2027. Utilising lignite through a surface gasification procedure in urea production is significant in mitigating this predicted deficit.
The scheme had been on the table for a long time, but it gained momentum after former prime minister Imran Khan committed to banning coal generation at the Climate Ambition Summit in December 2020 as part of Pakistan’s efforts to reduce its carbon footprint. Mr Khan also announced his intentions to convert domestic coal reserves to produce energy via coal-to-gas and coal-to-liquid processes.
The Pakistan Tehreek-i-Insaf (PTI) government had also done some initial work to formulate a policy to execute the proposal in collaboration with Oracle Power PLC — a natural resource and power project developer — and its Chinese partner, China National Coal Development Company (CNCDC).
The two companies submitted policies and proposals for the federal energy ministry at the beginning of 2021. The proposals outlined a draft commercial framework through which the development of coal to gas and liquid at Thar Block VI could be fast-tracked to address the country’s crippling gas shortage and reliance on imported liquid fuels.
Oracle’s Thar Block VI was even included in the China-Pakistan Economic Corridor (CPEC) portfolio to develop coal-to-gas and coal-to-liquids to assist Pakistan. Three urea producers — Engro, Fatima and Fauji — had also shown considerable interest in the project to augment their production capacities.
“The need for alternative sources of economically viable gas in Pakistan is clearly evident, and the government has sanctioned the conversion of coal-to-gas with this in mind. With the ongoing support of our consortium partners, including our technical partner and clean coal pioneer, CNCDC, we expect to be the front-runner in this burgeoning industry,” Oracle Pakistan Chief Executive Officer, Naheed Memon, was reported to have said at that time. “It is estimated that through the application of coal gasification, our Thar Block VI Project could produce and supply approximately 1,000m standard cubic feet per day.”
The then special assistant to the prime minister on CPEC, Khalid Mansoor, was also quite upbeat about the scheme. “The policy’s initial aim is to scale up Thar coal production for conversion to gas and oil, set up a petrochemical complex for a chain of industrial products, and eventually move on to other areas for fertiliser, fuel, and agriculture security.
“A policy draft has been shared with all the stakeholders so that the policy can be finalised and included in the coming budget,” he had told the media weeks before the ouster of the PTI government in April 2022.
On project viability, he maintained that there was no doubt about the technicalities. “I have seen several petrochemical complexes up and running in China. However, the main challenge would be concluding policy and securing financing to move towards the execution phase and have plants in place by 2028. If coal-to-gas is successful, a large fertiliser plant can be set at the mine-mouth of Thar coal.”
Among other proposals, Oracle had suggested fiscal incentives, including a waiver of customs duty on all plants and equipment not manufactured locally for coal-to-gas and coal-to-liquid technologies, to encourage their deployment. The items manufactured locally must be charged a duty of five per cent, besides a complete waiver of withholding tax and sales tax on all imported equipment used in these plants.
Moreover, the policy proposals demanded a lucrative 10-year income tax waiver from commercial operations, for which prior timelines would have to be committed and met. The policy was also supposed to provide an offtake/purchase plan for gas and liquids proposed to be produced from Thar coal and determine the prices.
Despite federal inertia, the Sindh Coal Authority continues to work on the scheme. Last year, it received confirmation from a South African laboratory that lignite coal found in the Thar Desert can be converted into gas, liquid and urea through surface gasification. The analysis, conducted as part of a ‘Pre Investment study — Coal to Gas, Coal to Liquid and Urea’, said that Thar coal has high tar yields of 20pc (air-dried basis) and high CO2 reactivity, which are typical of lignite coal and suitable for gasification.
“Everything except the policy is in place for the project to take off,” a Sindh Coal Authority official, who has remained part of the project since the beginning, told Dawn. “Without a policy providing clarity on tax and other incentives and concessions on investments, gas and oil pricing, and purchase agreement with gas companies and PSO, no private investor is prepared to put their capital.
“We have approached fertiliser firms, but they are reluctant to spend a significant sum of money on feasibility studies unless they have a clear idea of the coal-to-gas policy. So I don’t see any progress until the federal petroleum ministry finalises the policy document.”
He pointed out that India has recently launched a major coal gasification programme to install a coal gasification capacity of 100mtpa by 2030, involving an investment of $65 billion. The country has announced tax and other incentives totalling more than $100bn as the government targets to gasify 100m tonnes of coal by 2030.
Younis Dagha, a retired bureaucrat who had conceived and finalised the joint venture on Thar coal mining between the Sindh government and private sector companies to open up Thar coalfield for power generation, says gas transportation from Thar to the existing fertiliser plants would be a challenge. However, if the production facilities are shifted to the mine-mouth, urea manufacturing from synthetic gas would become cost-effective.
He lamented that bureaucratic hurdles were impeding the use of Thar coal to ensure the country’s energy and food security. “Without a robust policy, you cannot expect investors to bring their capital and invest in such projects,” he concluded.
Published in Dawn, The Business and Finance Weekly, March 18th, 2024
",https://www.dawn.com/news/1822265/stalled-energy-solution,business,2024-03-18
2,A Guyanese case study on oil,Energy-deficient Pakistan could learn from Guyana in successfully exploiting its energy assets via active global player participation.,"Guyana is the newest kid on the global energy bloc. The country’s growing oil assets, regarded by some as the find of the decade, are increasingly under the spotlight, giving rise to a new tug of war. As is always the case, attempts to grab the assets are on, both at the geopolitical and corporate levels.
Guyana’s offshore oil sector is booming, with over 11 billion barrels of oil equivalent resources discovered so far. Production is expected to reach roughly 620,000 barrels per day (bpd) once its Payara field reaches maximum capacity, and it could exceed 1.2 million bpd by 2028.
So far, 30 discoveries have been made, and many more are expected. With production anticipated to begin in Yellowtail in 2025 and Uaru in 2026, the country’s output could touch the 8m barrels equivalent per day, according to recent Standard & Poor’s Global estimates. However, the emerging resources are not without a curse.
Neighbouring Venezuela, boasting a large army with 337,000 personnel, is asserting ownership of the resource-rich Essequibo region of Guyana. Once supermajor Exxon made a swathe of high-quality oil discoveries in the waters off the Essequibo region, Venezuelan President Nicolas Maduro’s sabre-rattling intensified.

Energy-deficient Pakistan could learn from Guyana in successfully exploiting its energy assets via active global player participation

Venezuela is now claiming its rights to a 61,000 square mile area of Guyana, comprising roughly two-thirds of the sovereign territory. A heated debate between the two countries has begun. Caracas is accusing Georgetown of awarding Exxon illegal drilling licenses. It says Guyana has no right to award such licenses. Venezuela has also objected to Exxon’s drilling campaign, claiming the supermajor was engaging in corrupt conduct with key opposition figure, Maria Corina Machado, to move ahead on the project.
Matthew Smith reported in his piece in Oilprice.com, “Recent evidence suggests heightened military activity along Guyana’s border, raising fears of a potential invasion. By the end of 2023, there were fears Venezuela would use its military to annex the contested region.” To many, this is reminiscent of the invasion of Kuwait by the forces of Saddam Hussain in 1990.
Later, however, the presidents of Venezuela and Guyana agreed to resolve the dispute peacefully. Yet despite the agreement, “evidence of heightened Venezuelan military activity along Guyana’s border has [re]emerged, sparking fears Caracas is preparing to seize the [resource-rich] Essequibo by force.”
In the meantime, a corporate battle is also ongoing. Currently, Exxon controls all production in Guyana, holding a 45 per cent share in a consortium that includes the Hess Corporation and the China National Offshore Oil Corporation (CNOOC) as minority partners. Last October, Chevron Corp agreed to acquire Hess Corp for $53bn.
Analysts point out that Chevron’s bid to purchase Hess in October was primarily aimed at securing its 30pc stake in the Stabroek block off the coast of Guyana, currently one of the world’s fastest-growing oil developments and the biggest crude discovery in a decade.
Exxon is now claiming it has a right to first refusal of any sale of the Stabroek block off the coast of Guyana, containing at least 11bn barrels of oil. Late in February, ExxonMobil said it may pre-empt Chevron Corp’s acquisition of a 30pc stake in the giant Guyanese oil block. Many say the possible move by Exxon to pre-empt the Chevron-Hess deal could result in the breakup of Chevron’s $53bn deal to buy into the field.
Chevron stands adamant there’s “no possible scenario” where Exxon or CNOOC could buy the stake, adding that it remains fully committed to the Hess deal. Exxon and CNOOC’s right of first refusal is “not applicable” to its merger with Hess, Chevron said in an emailed statement sent to the media. “As described in the S-4, there is no possible scenario in which Exxon or CNOOC could acquire Hess’ interest in Guyana as a result of the Chevron-Hess transaction.”
However, Exxon is insisting that it has a duty to its shareholders to explore the right of first refusal over the change of ownership of the Hess stake.
In recent months, oil majors have struck a flurry of mega-deals to secure stakes in proven reserves without building new projects that would increase global supplies. Capitalising upon the sentiment, Guyana has been trying to attract more large oil producers to dilute Exxon’s dominance of the country’s energy output.
It recently held an offshore block auction that drew bids from TotalEnergies, Petronas and Qatar Energy. A battle royale between the oil giants is thus underway in Guyana.
The ongoing corporate dispute over Guyana’s Stabroek Block and the possibility of invasion of Guyana by Venezuela underscores “how important the emerging basin is to global crude markets”, Bloomberg underlined in a piece.
The evolving battleground of Guyana once again underlines oil and geopolitics are virtually inseparable.
For energy-deficient countries like Pakistan, Guyana presents a case study. The country has been successful in exploiting its energy assets through the active participation of global oil majors. Such projects require considerable investments and technological knowhow — oil majors’ posses both.
However, for oil majors to get involved in any such projects, political and economic stability in host countries remains a must. Consistency in policies is required and on a long-term basis.
Pakistan is not meeting these prerequisites. Despite having the potential, it has been unable to exploit and grow its domestic energy asset base in recent decades. To some, it has been a lost decade in many senses.
Oil majors and multinationals are slowly opting out of Pakistan. To achieve a semblance of success in the energy sector, we need to reverse this trend. Pakistan, and especially the Ministry of Petroleum, has a lot to relearn.
Published in Dawn, The Business and Finance Weekly, March 18th, 2024
",https://www.dawn.com/news/1822264/a-guyanese-case-study-on-oil,business,2024-03-18
