,Header,Summary,Detail,Link,Category,CreationDate
8,Hundreds of trees burnt as fire breaks out in Barkhan forest,"Officials said that the fire, which started on Saturday, has spread to 200 square kilometers.","QUETTA: Hundreds of trees and precious herbs were burnt to ashes on Sunday after a fire broke out in the forest of Koh-i-Jandaran, in Barkhan district of Balochistan. 
Officials said on Sunday that the fire, which started on Saturday, has spread to 200 square kilometers. The local people, after receiving information about the outbreak of fire in the forest, rushed to the mountain and started efforts to control it. 
“The fire damaged flora, trees and affected wildlife in the mountain Jandaran,” an official of the forest department said, adding that authorities have moved the nearby population to safer places.
There were conflicting claims about the area of the forest affected by the fire. 
Barkhan Assistant Commissioner Ramzan Ishtiaq said that flames have spread to an area exceeding 100 acres, while District Forest Officer Zubair Kakar said it has spread to over 200 acres. 
Locals, district administration and Frontier Corps (FC) personnel were engaged in efforts to bring the fire under control.
A team of Provincial Disaster Management Authority (PDMA) also reached the area to help contain the fire. 
“Extinguishing the fire is a challenging task as it is on the mountain peak. People living in the area near the fire have been taken to safer places,” Mr Ishtiaq, assistant commissioner of Barkhan, said. 
He said that apart from trees, there are vast quantities of dry shrubs which helped in rapid spread of the fire. The cause of the fire is yet to be determined, he said. 
Officials, late in the evening, claimed that fire has been brought under control by the PDMA, FC personnel of and local people to a great extent. However, efforts were under way to extinguish it completely on the Jandaran mountain.
The fire initially broke out on the other side of the mountain in uninhabited areas but spread to a large area due to heavy winds. 
People of the area said efforts of the government to extinguish the fire started very late and that resulted in damage to a large area of the forest.
Balochistan Chief Minister Mir Sarfraz Bugti took notice of the situation and directed the district administration, the PDMA and other relevant authorities to assist in relief efforts. 
PDMA Director General Jahanzeb Khan said that a team from PDMA has reached Barkhan with firefighting equipment and it has started helping local administration in fire extinguishing efforts.
The chief minister expressed satisfaction over timely joint efforts of officials of all departments and the district administration and directed them to establish a base at Barkhan district headquarters.
Published in Dawn, March 18th, 2024
",https://www.dawn.com/news/1822151/hundreds-of-trees-burnt-as-fire-breaks-out-in-barkhan-forest,national,2024-03-18
9,"Govt to offer global scholarships for  high achievers, says PM Shehbaz",The PM emphasised the crucial role of well-educated and skilled youth in the country’s future.,"

(LEFT) A file photo from 2022 shows PM Shehbaz interacting with Ikramullah during a visit to flood-hit Qila Saifullah. The two were reunited at the PM House on Sunday.—Handout photos

 
ISLAMABAD: Prime Minister Shehbaz Sharif on Sunday said that the federal government would facilitate high achievers with scholarship schemes to pursue education in reputable global institutes, emphasising the crucial role of well-educated and skilled youth in the country’s future.
The prime minister expressed these views during a meeting with Ikramullah, a student from Balochistan province currently studying in 9th class at Lawrence College Ghora Gali. 
Under the PM’s direction, the student from 2022 flood-hit area of Qila Saifullah was provided with an opportunity to get education at the country’s prominent educational institute. 
The prime minister recalled meeting the desperate student in the Khasnoob camp at Qila Saifullah in 2022 when floods had caused massive destruction in Balochistan. 
He mentioned that he had assured the student of the provision of quality education, adding that he was very pleased that the student was now studying at Lawrence College. The student thanked the prime minister for the opportunity to meet him.
Mr Sharif advised him to serve the nation and country by working hard and concentrating on his studies. 
Congratulating the prime minister on his victory in election, the student also expressed his resolve to achieve the goal and serve the country in the future. 
PM Shehbaz assured him that all his educational expenditures would be borne by the government as the students were the future of the country.
The prime minister mentioned that when he visited the flood-affected area, the student was agitating, but he was showing a discernible change. 
He also highlighted that in Punjab province, they had sent high achievers to receive education in the best institutions of Europe and when they returned they were completely transformed and full of confidence. 
Additionally, the prime minister welcomed the principal and housemaster of Lawrence College, giving gifts to the student, including a pen and tablet, expressing hope that it would aid in his studies. 
Ikramullah also presented a set of books to the prime minister.
Published in Dawn, March 18th, 2024
",https://www.dawn.com/news/1822159/govt-to-offer-global-scholarships-for-high-achievers-says-pm-shehbaz,national,2024-03-18
