,Header,Summary,Detail,Link,Category,CreationDate
10,"Woman ringleader of drug peddlers, six accomplices held",HYDERABAD: Police claimed to have arrested the woman ringleader of a drug peddling gang and its six members from the...,"HYDERABAD: Police claimed to have arrested the woman ringleader of a drug peddling gang and its six members from the SITE area on Thursday. 
The SITE police raided Miskeen Colony in Kotri to arrest Kiran alias commando who was allegedly running narcotics trade, including that of ice and heroin. 
When a police party raided her place in the area, gang members pelted them with stones, injuring ASIs Maula Bux Khokhar and Jan Mohammad Abro.
Later another police team led by the SITE police station SHO raided the area and the drug peddlers attacked them too with stones, causing injuries to two other policemen Hamza Ali and Sahib Khan.
Finally, the suspects surrendered. They included three women identified as Kiran, Mahtab and Ajeeba Ansari, and as many men, including Iqbal, Masood Akhtar and Rameez Ansari.
Published in Dawn, April 7th, 2023
",https://www.dawn.com/news/1746261/woman-ringleader-of-drug-peddlers-six-accomplices-held,karachi,2023-04-07
11,Moot urges govt to make human rights part of syllabus,"LARKANA: Social activists have urged the government to incorporate human rights as a subject in school, college and...","LARKANA: Social activists have urged the government to incorporate human rights as a subject in school, college and university curriculum so as to sensitise youth to their basic rights guaranteed under the constitution and law.
They were speaking at a seminar on “Basic human rights and our responsibilities” held at Indus School under the aegis of Knowledge Centre here on Thursday. 
Iqbal Detho, chairman of Sindh Human Rights Commission, said that the constitution guaranteed equal rights for all sections of population without any discrimination based on creed, colour or caste. 
“We have to formulate new policies or change the existing ones to ensure provision of rights to life, liberty, dignity, health, expression, water, food, pure air and shelter, which are fundamental rights and all people should get equally and easily,” he said.
He said that Islam is a religion of peace and it demanded justice for all. Other religions of the world also urged their believers to adopt the path of peace, he said. 
He said that bullying at schools, streets and at any other place was illegal. The schools’ syllabus should include teaching of human rights so as to sensitise youth to the importance of their rights and empower them, he said.
He said the human rights emanated from religion, political struggles, philosophers and constitutional developments. Education in human rights was key component of the commission which would be incorporated in syllabus and curriculum of schools, colleges and universities, he said.
Ayoub Khoso, prominent TV, film actor and member of the commission, said that social media was a very important tool to make people aware of human rights. If used positively social media helped one have his or her rights respected by all, he said. 
He said that everyone should know about his and others’ basic rights in society. Man and woman were equal before law which did not tolerate violation of rights of any section of the population, he said.
Prof Mukhtiar Ahmed Samo, founder of Knowledge Centre, said that the societies where violation of human rights was in practice did not attain peace and prosperity. It was the need of the hour that all policies formulated for providing human rights were implemented, he said.
Mr Detho along with MPA Ms Farhat Simin and Mr Khoso later visited district prison and correctional facility and conducted a detailed inspection of the state of living conditions of inmates and inquired about issues of their representation in courts.
Representatives of Legal Aid Society and Pakistan Legal United Society also accompanied the SHRC chairman and his team, who identified inmates in need of legal assistance. 
The chairman expressed satisfaction at jail affairs and expressed surprise that 70 per cent of UTPs were indicted under narcotics laws. The commission would thoroughly probe the issue to learn why majority of the people were being charged with keeping illicit drugs, he said.
Published in Dawn, April 7th, 2023
",https://www.dawn.com/news/1746260/moot-urges-govt-to-make-human-rights-part-of-syllabus,karachi,2023-04-07
12,"Elderly man, girl die in roof, wall collapse incidents",SUKKUR: An elderly man and a small girl were killed and two young boys sustained injuries in different incidents in...,"SUKKUR: An elderly man and a small girl were killed and two young boys sustained injuries in different incidents in which a ceiling caved in and walls of a dilapidated house collapsed in Jacobabad on Thursday.
Neighbours rushed to rescue the inmates after hearing a large thud from the house collapse in Kamora Line area within the jurisdiction of Civil Lines police station and retrieved the body of Rajhan Khan Lashari from under the debris. 
In the other incident, 11-year-old Raheela Junejo died and 13-year-old Ghulam Junejo and 10-year-old Israr Unnar suffered injuries when roof their house caved in on them in Abad area on the outskirts of Jacobabad.
The relatives retrieved the dead body and the injured from under the debris and took them to the civil hospital. The injured were later moved to Airbase hospital for treatment.
Published in Dawn, April 7th, 2023
",https://www.dawn.com/news/1746259/elderly-man-girl-die-in-roof-wall-collapse-incidents,karachi,2023-04-07
13,Experts call for promoting youths’ business ideas,"HYDERABAD: Emp-hasising the importance of the role of the youth in education, industrial and economic sectors,...","HYDERABAD: Emp-hasising the importance of the role of the youth in education, industrial and economic sectors, experts have said that a joint strategy should be devised to promote business ideas floated by them. 
They said that cooperation would have to be extended to the youth in value chain and entrepreneurship for the prosperity of Sindh and Pakistan and for changing the life style of people.
They were speaking at a seminar on the ‘Business Opportunities and Role of Youth” organised at the Sindh Agriculture University (SAU) Tandojam on Thursday. 
Speaking on the occasion, SAU Vice Chancellor Dr Fateh Mari said the youth should be encouraged for business activities as per their educational background in the larger interest of Pakistan’s economy and prosperity. 
He said institutions should come forward and put an end to the sense of self deprivation prevailing among the young people and an advantage should be taken of their abilities. 
The VC said they should be trained for their business ideas, considering market demands, and universities could play the role of a bridge in that regard.
Prof Bhawani Shankar Chaudhry said business opportunities were available across the world for the youth in the light of their competence and abilities. The youth should only be encouraged in that regard, he added. 
He stated that the Higher Education Commission (HEC) and universities needed to cooperate with the youth for choosing their career. Thousands of students were being provided scholarships and training so that they could change their own life, he added.
Dr Prem Sagar said that many international celebrities had achieved success in life through businesses and got some position. He said that it was also incumbent upon the SAU students to develop products depending on market demand and then sale them. It would benefit them financially and somehow lead to food security, he observed.
Dr Shankar presented a gift of his books to the SAU vice chancellor. Present on the occasion were Dr Ismail Kumbhar, Dr Aijaz Ali Khuharo Dr Ghayasuddin Shah Rashdi and Dr Altaf Siyal.
Published in Dawn, April 7th, 2023
",https://www.dawn.com/news/1746258/experts-call-for-promoting-youths-business-ideas,karachi,2023-04-07
14,Enraged mob attacks police station after UTP’s death in jail,"MIRPURKHAS: An enraged mob of Khoso tribesmen attacked Kot Ghulam Mohammad police station, ransacked and bunt...","MIRPURKHAS: An enraged mob of Khoso tribesmen attacked Kot Ghulam Mohammad police station, ransacked and bunt furniture and pelted policemen with stones in the wake of death of their relative in Mirpurkhas central prison late on Wednesday night.
The protesters placed dead body of deceased Chanesar Khosa aka Dado Khosa outside the press club to record protest before attacking the police station. 
The jail administration claimed that the under trial prisoner Chanesar Khosa was rushed to Mirpurkhas Civil Hospital after his condition suddenly deteriorated. He died during treatment, said the jail officials. 
They said the deceased was in jail in a narcotic case and was himself an addict. 
When the heirs received the body of their relative after post mortem, they alleged that Chanesar had been tortured to torture.
They said the jail officials had demanded huge bribe, when they refused to pay it they tortured him to death. His body had also several marks of torture, they said. 
Later, the heirs and relatives of the victims brought the body to the press club and held a demonstration against the central prison administration. They demanded high level inquiry into the death and registration of murder case against jail officials. 
After having their protest recorded at the press club, the protesters carried the body to the Kot Ghulam Muhammad police station where they pelted policemen with stones, ransacked and burnt the furniture. 
Later, SHO and DSP of Digri rushed to the police station and dispersed the attackers. 
On Thursday, the Khosa tribesmen blocked the Kot Ghulam Muhammad-Samaro road in protest, bringing the traffic to a halt. Heavy police contingents later rushed to the protest venue brought the situation under control by holding negotiations with the protesters Police broke up the protest and opened the road for traffic.
Published in Dawn, April 7th, 2023
",https://www.dawn.com/news/1746257/enraged-mob-attacks-police-station-after-utps-death-in-jail,karachi,2023-04-07
