,Header,Summary,Detail,Link,Category,CreationDate
11,Two killed by rivals over ‘indiscreet’ remarks,"NAROWAL: Two persons, including a 12-year-old passer-by, were shot dead and another injured by their rivals over ...","NAROWAL: Two persons, including a 12-year-old passer-by, were shot dead and another injured by their rivals over some ‘indiscreet’ remarks here on Thursday in Rehmatpur locality of Shakargarh tehsil.  
Shahzad Nisar in his complaint to the police said he along with his brother Ehsan Nisar and friend Mohammad Shoaib was standing near the police station when suspects Muhammad Adeel, Sunny Khan and their four accomplices allegedly opened fire on them.  
He said his brother Ehsan Nisar, Shoaib and a 12-year-old boy Maharib Anwar, a passer-by, were seriously injured in the firing. 
He said his brother and the boy succumbed to their injuries on the spot. He said injured Shoaib was first shifted to Tehsil Headquarters Hospital Shakargarh from where doctors referred him to Narowal DHQ Hospital.  
City Shakargarh police have registered a murder case against Adeel, Sunny Khan and four unknown suspects.  
Shakargarh DSP Rai Ehsan Elahi said on the order of District Police Officer Narowal Rana Tahir Rehman Khan, raiding teams had been formed for the arrest of the suspects.  
ARRESTED: Police have registered a case against a man for snatching a 10 kg bag of flour from the distribution centre.  
Naib Tehsildar Shakargarh Syed Shahid Mumtaz Haider told the police that a labourer later identified as Sarfaraz Atiq forcibly snatched a bag of 10 kg from the free flour distribution centre set up by the government in Ikhlaspur town. 
He said during the distribution of free flour, Sarfaraz snatched a bag from the truck and he was immediately caught.
Kot Nainan police have registered a first information report against the suspect on the complaint of naib tehsildar and arrested him.
Published in Dawn, April 7th, 2023
",https://www.dawn.com/news/1746278/two-killed-by-rivals-over-indiscreet-remarks,lahore,2023-04-07
12,Two suspects flee CIA police custody after breaking lock-up,"TOBE TEK SINGH: Two suspects who were under arrest for investigation of robberies with Faisalabad CIA staff police,...","TOBE TEK SINGH: Two suspects who were under arrest for investigation of robberies with Faisalabad CIA staff police, absconded from Factory Area police station on Wednesday night by breaking the lock-up.
The police arrested six policemen responsible for their escape in a case registered on Thursday against them under sections 222 and 223 of the Pakistan Penal Code and 155C of the Police Order.
Complainant Muhammad Usman Khan, who is the Factory Area police circle DSP, stated in his FIR that the CIA staff lodged in lock-up both Waqar Qari of Chak 222-RB and Nadim Majeed of Muzaffar Colony from where they escaped by cutting iron bars.
SHO Muhammad Siddiq, Iqbal Town CIA staff police in-charge Muzammal Abbas, Factory Area police station muharrar Muhammad Naveed, naib muharrar Irshad Ahmad, Iqbal Town CIA staff police station muharrar Izhar Hussain Shah and duty constable Shaukat Ali were suspended from service and arrested.  
A police team is raiding places to re-arrest the absconded outlaws.
KILLER: A woman from Jhang’s Geelani Town locality turned out to be the killer of her father.  
Earlier, she told people and relatives that her father Zulfiqar Ali, 73, went out of the house on March 17 and disappeared.
When Jhang’s Satellite Town police interrogated Sadia Bibi, she said she and her friend Ashraf had strangled her father as he was a hurdle in their relationship.  
Complainant Ghulam Yasin claimed in his FIR registered on Thursday that his sister, Sadia Bibi, had been living with her father for the last 10 years after separation from her husband, Haq Nawaz. She developed an affair with Ashraf, but his father would force her not to do so over which they buried him after strangling him in the courtyard of the same house.  
The police recovered the body.
WALK: An awareness walk was organised on Thursday in Faisalabad on the occasion of the World Sports Day for Development and Peace by the Directorate of Sports of the Government College University, Faisalabad.  
A press release said the aim of the walk was to highlight the positive role of sports for development and peace in society.
Published in Dawn, April 7th, 2023
",https://www.dawn.com/news/1746277/two-suspects-flee-cia-police-custody-after-breaking-lock-up,lahore,2023-04-07
13,"Robber injured, arrested after encounter",OKARA: A robbery suspect was arrested after being injured in an encounter with the police near Renala Bypass while...,"OKARA: A robbery suspect was arrested after being injured in an encounter with the police near Renala Bypass while his four accomplices managed to escape.  
As per the first information report (FIR), a police patrol team, headed by Inspector Muhammad Akhtar Khan, was near a private housing scheme on the eastern side of the Renala Bypass when it received information about a group of gunmen robbing motorcyclists and motorists on the national highway.  
Inspector Khan called 15 helpline for more police force to reach the site. When the police reached there, the suspects opened fire on the policemen who retaliated and the crossfire continued for about five minutes.  
Later, the police found an injured suspect beside the road and arrested him. He introduced himself as Tajammal Hussain and identified his fleeing accomplices as Waris, Razzaq, Amir and Shoaib, residents of Chak 25/2-R.  
A vehicle registered in the name of Abdul Qadir, cash and weapons were recovered from the site.  
The injured suspect was shifted to Tehsil Headquarters Hospital, Renala. On the report of Inspector Akhtar Khan, City Renala police registered a case.  
BOOKED: A woman got registered a case against her son for manhandling her.  
As per the FIR, Irfan, son of Ihsaan and Ghulam Fatima, residents of village Qila Tara Singh near Depalpur, used to disgrace and manhandle his elderly mother. On the report of the woman, City police have registered a case against her son under the Protection of Parents Act.   
HAILSTORM: Hailstorm and rain damaged the maize and wheat crops on Wednesday.  
In the last three weeks, frequent rain and thunderstorm flattened a notable portion of wheat crop and the night between Wednesday and Thursday, hailstorm and rain damaged the maize and wheat crops.  
In most areas of the district, there was more hailstorm and less rain.
Published in Dawn, April 7th, 2023
",https://www.dawn.com/news/1746276/robber-injured-arrested-after-encounter,lahore,2023-04-07
14,Heart patient dies at free flour centre,"MUZAFFARGARH: A 48 years old man died at a free flour point in Jatoi, 100 kilometres from here, on Thursday....","MUZAFFARGARH: A 48 years old man died at a free flour point in Jatoi, 100 kilometres from here, on Thursday.  
Rescue 1122 said Bashir Ahmed’s death was due to heart attack. As he collapsed waiting for his share of the staple food, rescuers rushed him to a nearby health facility but he could not survive.
Deputy Commissioner Salman Khan Lodhi said when Ahmed complained of pain at the sale point in the morning, a rescue team gave him first aid. Later, he was shifted to the Jatoi THQ Hospital where doctors said his pain was due to a massive heart attack. 
The DC said Ahmed was referred to the Muzaffargarh DHQ Hospital where he died after some hours.  
DC Salman Lodhi  said Ahmed’s family had confirmed that he was a heart patient.  
COMPENSATION: The compensation announced by caretaker Chief Minister Mohsin Naqvi for the heirs of those who died in free flour points’ stampede has not reached them.   
Bashir Ahmed was the third person who died at flour centre in Muzaffargarh district since the beginning of Ramazan.  
DC Salman Lodhi said more than 2.1 million bags of flour would be distributed free of cost to more than 700,000 families in Muzaffargarh and Kot Addu districts. He said more than 30 free flour points were working in the two districts.  
He said the process of flour distribution was completely transparent.
Published in Dawn, April 7th, 2023
",https://www.dawn.com/news/1746275/heart-patient-dies-at-free-flour-centre,lahore,2023-04-07
15,Pharmacy robbed by gunmen,CHINIOT: A pharmacy in the city fell victim to a robbery carried out by three gunmen late on Wednesday. Customers...,"CHINIOT: A pharmacy in the city fell victim to a robbery carried out by three gunmen late on Wednesday.  
Customers Farhan Ali, Muhammad Ali and Ameer had their mobile phones snatched, while the pharmacy counter was robbed of Rs25,000.  
Additionally, Farhan Ali’s motorcycle was stolen. The City police registered a case under section 392 of the Pakistan Penal Code.  
Dr Tahir Rasheed Sial, chairman of the Chemists and Druggists Association, condemned the robbery, saying that pharmacies are open round-the-clock to provide life-saving drugs in the event of an emergency. 
ENCOUNTER: A gunman was arrested in an injured condition after an encounter with the Bhowana police late on Wednesday.
SHO Allah Ditta said they were patrolling Bhowana-Pansara Road when they spotted three gunmen near a drain bridge. 
The police ordered them to surrender, but the gunmen responded with gunfire, prompting the police to retaliate. One of the gunmen, Nasir Ali from Faisalabad, was injured during the exchange and subsequently arrested.  
The police confiscated a pistol from him. He confessed to committing highway robberies with his accomplices, Fateh Sher Muslim Sheikh, of Chak 184-JB, and Safraz Ahmad from Chak 393, Faisalabad. 
He was shifted to the Bhowana THQ Hospital.
Published in Dawn, April 7th, 2023
",https://www.dawn.com/news/1746273/pharmacy-robbed-by-gunmen,lahore,2023-04-07
16,"More water, electricity resources stressed",LAHORE: Hundreds of power workers participated in a meeting held at Bakhtiar Labour Hall in honour of Lesco former...,"LAHORE: Hundreds of power workers participated in a meeting held at Bakhtiar Labour Hall in honour of Lesco former chief executive officer Chaudhry Amin on his retirement on Thursday.  
The participants in the meeting organised by the All Pakistan Wapda Hydro Electric Workers Union prayed for the progress of the country, elimination of poverty and unemployment and price hike. 
Union secretary general Khurshid Ahmad stressed the need for development of electricity, water resources, industry, agriculture and trade to meet the economic needs of the nation or payment of foreign debts. He demanded the government take steps to stop tragic accidents of the line staff due to serious shortage of staff due to no recruitment policy for the last six years. He appreciated the dedicated services of Chaudhry Muhammad Amin.  
The meeting was also addressed by Osama Tariq, Haji Younas, Muzaffar Mateen, Rana Shakoor and other representatives of the union.
Published in Dawn, April 7th, 2023
",https://www.dawn.com/news/1746271/more-water-electricity-resources-stressed,lahore,2023-04-07
17,Interest rate hike ‘fatal’ for industry,DERA GHAZI KHAN: Dera Ghazi Khan Chamber of Commerce and Industry President Khwaja Muhammed Ilyas says just one per...,"DERA GHAZI KHAN: Dera Ghazi Khan Chamber of Commerce and Industry President Khwaja Muhammed Ilyas says just one per cent increase in the rate of profit of banks means an ‘economic killing’ of the industries and commercial establishments.  
“The business is suffering from a severe slowdown.  Many commercial and industrial establishments are on their last breaths. This move will cause further destruction of trade and economy,” he told newsmen here on Thursday.
The Dera chamber, through a unanimous resolution, urged the government to immediately lower the markup rate to revive business activities.
Published in Dawn, April 7th, 2023
",https://www.dawn.com/news/1746270/interest-rate-hike-fatal-for-industry,lahore,2023-04-07
